tsz,év,szerző,cím,mtmt,idézettség,0.01%,0.10%,1.00%,10.00%,20.00%,50.00%
Analízis,2022,Karátson János,Quasi-Newton variable preconditioning for nonlinear nonuniformly monotone elliptic problems posed in Banach spaces,32034148,7,0,0,1,1,1,1
Differenciálegyenletek,2018,Kovács Mihály,Boundary conditions for fractional diffusion,3348787,45,0,0,1,1,1,1
Analízis,2018,Weiner Mihály,From vertex operator algebras to conformal nets and back,3327040,61,0,0,1,1,1,1
Sztochasztika,2019,Bárány Balázs,Hausdorff dimension of planar self-affine sets and measures,30603311,45,0,0,1,1,1,1
Algebra,2016,Hegedűs Pál,On the Discrete Logarithmic Minkowski Problem,3121562,69,0,0,1,1,1,1
Sztochasztika,2015,Vető Bálint,Height Fluctuations for the Stationary KPZ Equation,2995258,101,0,0,1,1,1,1
Analízis,2020,Zimborás Zoltán,Mitigation of readout noise in near-term quantum devices by classical post-processing based on detector tomography,31312571,82,0,0,1,1,1,1
