publishedYear,name,authors,independentCitingPubCount,types
2014,Strong order of convergence of a fully discrete approximation of a linear stochastic volterra type evolution equation,Kovács Mihály,21,JournalArticle
2014,"FINITE ELEMENT APPROXIMATION OF THE CAHN-HILLIARD-COOK EQUATION (vol 49, pg 2407, 2011)",Kovács Mihály,5,JournalArticle
2013,Weak convergence of finite element approximations of linear stochastic evolution equations with additive noise II. Fully discrete schemes,Kovács Mihály,28,JournalArticle
2004,Bisectors in Minkowski 3-space,G. Horváth Ákos,11,JournalArticle
2003,A brief history of the Department of Geometry between anniversaries 40 and 50,G. Horváth Ákos,0,JournalArticle
2003,Skew lines in hyperbolic space,G. Horváth Ákos,0,JournalArticle
2003,On the second-order Reed-Muller code,G. Horváth Ákos,1,JournalArticle
2003,Polygons with equal angles in the hyperbolic plane,G. Horváth Ákos,0,JournalArticle
2001,Packing congruent bricks into a cube,"G. Horváth Ákos,Prok István",0,JournalArticle
2000,On bisectors in Minkowski normed spaces,G. Horváth Ákos,28,JournalArticle
1999,On the boundary of an extremal body,G. Horváth Ákos,10,JournalArticle
1997,"Lower bounds of the maximal coordinates of minimum vectors,",G. Horváth Ákos,4,BookChapter
1997,Dissections of a centrally symmetric hexagon,G. Horváth Ákos,4,BookChapter
2001,New results in pension modelling,Simonovits András,1,JournalArticle
2000,A korosztályi elszámolás Magyarországon,Simonovits András,3,Book
2000,A nyugdíjreform a korosztályi elszámolás tükrében,Simonovits András,3,BookChapter
2000,Korosztályi számlák,Simonovits András,4,BookChapter
2000,Racionalitás és méltányosság,Simonovits András,1,Book
2000,"Planning, shortage, and transformation",Simonovits András,6,Book
2000,Bevezetés a nyugdíjmodellezésbe,Simonovits András,4,Book
2000,Harsányi János,Simonovits András,0,JournalArticle
2000,Komplexitás,Simonovits András,0,JournalArticle
2000,"Zalai Ernő: Matematikai közgazdaságtan (A korszerű mikroökonómiai elemzés klasszikus és neoklasszikus szemléletű modelljei), KJK-Kerszöv, Budapest, 2000., pp. 896.",Simonovits András,0,JournalArticle
2013,"WEAK CONVERGENCE OF RANDOM WALKS, CONDITIONED TO STAY AWAY FROM SMALL SETS",Szász Domokos,0,JournalArticle
2013,Tail asymptotics of free path lengths for the periodic Lorentz process. On Dettmann's geometric conjectures,Szász Domokos,0,PublicationOther
2012,Mixing rates of particle systems with energy exchange,Szász Domokos,16,JournalArticle
2012,Lorentz Process with shrinking holes in a wall,Szász Domokos,4,JournalArticle
2012,A central limit theorem for time-dependent dynamical systems,Szász Domokos,16,JournalArticle
2012,Energy transfer and joint diffusion,Szász Domokos,0,JournalArticle
2011,"John von Neumann, the Mathematician",Szász Domokos,2,JournalArticle
2010,Locally Perturbed Random Walks with Unbounded Jumps,Szász Domokos,6,JournalArticle
2010,BILLIARD MODELS AND ENERGY TRANSFER,"Szász Domokos,Sándor Csaba",0,BookChapter
2010,BILLIARD MODELS AND ENERGY TRANSFER,"Szász Domokos,Tóth Imre Péter",0,BookChapter
2010,Perturbation approach to scaled type Markov renewal processes with infinite mean,Szász Domokos,0,PublicationOther
2022,On Bounded Two-Dimensional Globally Dissipative Euler Flows,Kolumbán József,0,JournalArticle
2022,Remote trajectory tracking of a rigid body in an incompressible fluid at low Reynolds number,Kolumbán József,0,JournalArticle
2021,A New Approach to the Rayleigh–Taylor Instability,Kolumbán József,3,JournalArticle
2021,Relaxation of the Boussinesq system and applications to the Rayleigh–Taylor instability,Kolumbán József,1,JournalArticle
2021,Remote trajectory tracking of rigid bodies immersed in a two-dimensional perfect incompressible fluid,Kolumbán József,0,JournalArticle
2020,External boundary control of the motion of a rigid body immersed in a perfect two-dimensional fluid,Kolumbán József,0,JournalArticle
2020,Control at a distance of the motion of a rigid body immersed in a two-dimensional viscous incompressible fluid,Kolumbán József,0,JournalArticle
2015,Existence and localization of solutions for operatorial systems defined on Cartesian product of Fréchet spaces using a new vector version of Krasnoselskii’s cone compression–expansion theorem,Kolumbán József,0,JournalArticle
2014,Meaned Spaces and a General Duality Principle,Kolumbán József,0,BookChapter
2013,On the Ulam–Hyers stability of first order differential systems with nonlocal initial conditions,Kolumbán József,41,JournalArticle
2022,Packings with geodesic and translation balls and their visualizations in ̃SL2R space,"Molnár Emil,Szirmai Jenő",0,JournalArticle
2022,"On homogeneous 3-geometries, balls and their optimal arrangements, especially in Nil and Sol spaces","Szirmai Jenő,Molnár Emil",0,JournalArticle
2021,"Ideal simplices and double-simplices, their non-orientable hyperbolic manifolds, cone manifolds and orbifolds with Dehn type surgeries and graphic analysis","Molnár Emil,Prok István,Szirmai Jenő",0,JournalArticle
2021,Surgeries of the Gieseking hyperbolic ideal simplex manifold,"Molnár Emil,Prok István,Szirmai Jenő",0,JournalArticle
2020,"INFINITE SERIES OF COMPACT HYPERBOLIC MANIFOLDS, AS POSSIBLE CRYSTAL STRUCTURES","Molnár Emil,Szirmai Jenő",0,JournalArticle
2019,Non-euclidean crystallography,Molnár Emil,0,JournalArticle
2019,EGY SZÁMELMÉLETI JÁTÉK ÉS TANULSÁGAI,Molnár Emil,0,JournalArticle
2019,From a nice tiling to theory and applications,"Molnár Emil,Prok István,Szirmai Jenő",0,BookChapter
2018,Hyperbolic Space Forms with Crystallographic Applications and Visualizations,"Molnár Emil,Szirmai Jenő",1,BookChapter
2018,An Algorithm for Classification of Fundamental Polygons for a Plane Discontinuous Group,Molnár Emil,1,BookChapter
1994,On the number of the minima of $N$-lattices,G. Horváth Ákos,2,JournalArticle
1993,N-rácsok minimális vektorai.,G. Horváth Ákos,0,Thesis
1992,Scientific activities of the staff of the department of Geometry 1977 to 1992,G. Horváth Ákos,0,JournalArticle
1992,On a question of K. Bezdek and T. Odor on $\Lambda$-parallelotopes,G. Horváth Ákos,1,JournalArticle
1992,Codes and lattices,G. Horváth Ákos,1,JournalArticle
1990,On double-latticelike spherepacking,G. Horváth Ákos,0,JournalArticle
1989,On a polynomial algorithm for selecting a lattice-basis containing a given primitive system,G. Horváth Ákos,0,JournalArticle
1989,Algebraic characterization of primitive systems,G. Horváth Ákos,0,JournalArticle
1987,Konstruktiv módszerek a rácsgeometriában.,G. Horváth Ákos,0,Thesis
1986,On the basis reduction problem,G. Horváth Ákos,0,BookChapter
2015,A New Method of Language Vitality Assessment,Kornai András,0,BookChapter
2015,Realizing Monads,Kornai András,0,JournalArticle
2014,Corpus-based Population of a Mid-level Business Ontology,Kornai András,0,BookChapter
2014,Resolving the infinitude controversy,Kornai András,6,JournalArticle
2014,Bounding the impact of AGI,Kornai András,14,JournalArticle
2014,Finite automata with continuous input,Kornai András,1,BookChapter
2014,Indian Subcontinent Language Vitalization,Kornai András,0,BookChapter
2014,Euclidean Automata,Kornai András,5,BookChapter
2013,Building basic vocabulary across 40 languages,Kornai András,26,BookChapter
2013,The mathematics of language learning,Kornai András,0,BookChapter
2022,Density Estimates of 1-Avoiding Sets via Higher Order Correlations,Matolcsi Máté,2,JournalArticle
2022,The Fuglede conjecture for convex domains is true in all dimensions,Matolcsi Máté,0,JournalArticle
2021,A Rigidity Property of Complete Systems of Mutually Unbiased Bases,"Matolcsi Máté,Weiner Mihály",0,JournalArticle
2021,Difference Sets and Positive Exponential Sums. II: Cubic Residues in Cyclic Groups,Matolcsi Máté,1,JournalArticle
2020,Triangulations and a Discrete Brunn–Minkowski Inequality in the Plane,Matolcsi Máté,3,JournalArticle
2018,An application of positive definite functions to the problem of MUBs,"Matolcsi Máté,Weiner Mihály",1,JournalArticle
2018,Character tables and the problem of existence of finite projective planes,"Matolcsi Máté,Weiner Mihály",0,JournalArticle
2018,Finite projective planes and the Delsarte LP-bound,"Matolcsi Máté,Weiner Mihály",0,JournalArticle
2016,Better Bounds for Planar Sets Avoiding Unit Distances,Matolcsi Máté,7,JournalArticle
2015,Cell-specific STORM super-resolution imaging reveals nanoscale organization of cannabinoid signaling.,Matolcsi Máté,149,JournalArticle
2017,An Estimation of the Learning Effect on Project Cost Scheduling,Varga Anita,2,JournalArticle
2016,An Estimation of the Learning Curve Effect on Project Scheduling with Working Days Calculation,Varga Anita,0,JournalArticle
2019,Who are the most important “suppliers” for universities? - Ranking secondary schools based on their students’ university performance,Molontay Roland,1,BookChapter
2019,Two decades of network science: : as seen through the co-authorship network of network scientists,"Molontay Roland,Nagy Marcell",18,BookChapter
2019,Machine learning algorithms for predicting academic performance and identifying the contributing factors,"Molontay Roland,Nagy Marcell",0,BookChapter
2019,On the Complexity of Color-Avoiding Site and Bond Percolation,Molontay Roland,1,BookChapter
2018,Hogyan hatnak a pénzügyi ösztönzők az egyetemi oktatók osztályozási gyakorlatára? Egy természetes kísérlet eredményei,Molontay Roland,0,PublicationOther
2018,How financially rewarding student evaluation affect grade inflation? Evidence from a natural experiment,Molontay Roland,0,BookChapter
2018,Visualizing student flows to track retention and graduation rates,Molontay Roland,4,BookChapter
2018,Modified box dimension of trees and hierarchical scale-free graphs,"Molontay Roland,Simon Károly",0,BookChapter
2018,Predictive power of admission point score and its variants on academic performance,"Nagy Marcell,Molontay Roland",0,BookChapter
2018,Predicting Dropout in Higher Education based on Secondary School Performance,"Nagy Marcell,Molontay Roland",37,BookChapter
2022,Robust energy-to-peak filter design for a class of unstable polytopic systems with a macroeconomic application,Gyurkovics Éva,1,JournalArticle
2020,Dynamic output feedback H ∞ design in finite-frequency domain for constrained linear systems,Gyurkovics Éva,4,JournalArticle
2020,LMI approach to global stability analysis of stochastic delayed Lotka–Volterra models,"Kiss Krisztina,Gyurkovics Éva",3,JournalArticle
2019,Comparison of some bounding inequalities applied in stability analysis of time-delay systems,Gyurkovics Éva,8,JournalArticle
2019,Sliding mode synchronization of a delayed complex dynamical network in the presence of uncertainties and external disturbances,Gyurkovics Éva,3,JournalArticle
2018,Non-fragile exponential synchronization of delayed complex dynamical networks with transmission delay via sampled-data control,"Gyurkovics Éva,Kiss Krisztina",8,JournalArticle
2017,A note on relationship between some bounding inequalities in stability analysis of time-delay systems,Gyurkovics Éva,1,PublicationOther
2017,Multiple summation inequalities and their application to stability analysis of discrete-time delay systems,"Gyurkovics Éva,Kiss Krisztina,Nagy Ilona",30,JournalArticle
2017,Stability analysis of linear systems with interval time-varying delays utilizing multiple integral inequalities,"Gyurkovics Éva,Kiss Krisztina",22,JournalArticle
2016,Guaranteed cost control of discrete-time uncertain systems with both state and input delays,Gyurkovics Éva,14,JournalArticle
2022,Analytic investigation of the compatibility condition and the initial evolution of a smooth velocity field for the Navier–Stokes equation in a channel configuration,Kiss Márton,0,JournalArticle
2020,Spectral Determinants and an Ambarzumian Type Theorem on Graphs,Kiss Márton,3,JournalArticle
2019,Chaotic backward shift operator on Chebyshev polynomials,Kiss Márton,0,JournalArticle
2018,Differenciálegyenletek - Neptun elektronikus tananyag,Kiss Márton,0,Book
2017,Complexity in Linear Systems,Kiss Márton,2,JournalArticle
2017,An inverse eigenvalue problem for one dimensional Dirac operators,Kiss Márton,0,JournalArticle
2017,A CHAOTIC LINEAR OPERATOR ON THE SPACE OF ODD 2Π−PERIODIC FUNCTIONS,Kiss Márton,0,BookChapter
2011,Gépészkari matematika MSC,Kiss Márton,0,Book
2011,Stability of direct and inverse eigenvalue problems: the case of complex potentials,"Horváth Miklós Tibor,Kiss Márton",6,JournalArticle
2010,Stability of direct and inverse eigenvalue problems for Schrödinger operators on finite intervals,"Horváth Miklós Tibor,Kiss Márton",11,JournalArticle
2018,Expected Value Minimization in Information Theoretic Multiple Priors Models,Csiszár Imre,2,JournalArticle
2017,Error Exponents for Sparse Communication,"Farkas Lóránt Ernő,Kói Tamás,Csiszár Imre",0,BookChapter
2016,Measuring distribution model risk,Csiszár Imre,35,JournalArticle
2016,Convergence of generalized entropy minimizers in sequences of convex problems,Csiszár Imre,0,BookChapter
2015,An information geometry problem in mathematical finance,Csiszár Imre,4,JournalArticle
2013,On oblivious transfer capacity,Csiszár Imre,19,JournalArticle
2013,"Information Geometry in Mathematical Finance: Model Risk, Worst and Almost Worst Scenarios",Csiszár Imre,0,BookChapter
2013,Systematic stress tests with entropic plausibility constraints,Csiszár Imre,40,JournalArticle
2013,Secrecy generation for multiaccess channel models,Csiszár Imre,15,JournalArticle
2013,Generalized minimizers of convex integral functionals and Pythagorean identities,Csiszár Imre,0,JournalArticle
2022,On the probability that two elements of a finite semigroup have the same right matrix,"Nagy Attila,Tóth Csaba",0,JournalArticle
2021,On special Rees matrix semigroups over semigroups,"Nagy Attila,Tóth Csaba",0,PublicationOther
2020,University rankings from the revealed preferences of the applicants,Tóth Csaba,16,JournalArticle
2022,Exercise-related hemoconcentration and hemodilution in hydrated and dehydrated athletes,Koós Krisztiánné Szilágyi Brigitta,0,JournalArticle
2022,High-Resolution Dynamics of Hemodilution After Exercise-Related Hemoconcentration,Koós Krisztiánné Szilágyi Brigitta,0,JournalArticle
2022,Changes in learning strategy and learning time in the wake of the pandemic,"Sipos Bence,Koós Krisztiánné Szilágyi Brigitta",0,BookChapter
2021,A geometriai gondolkodás szintjeinek feltérképezése a van Hiele-elmélet segítségével,Koós Krisztiánné Szilágyi Brigitta,0,JournalArticle
2021,c-spectral isometries of skew-symmetric matrices: The eight dimensional case,Koós Krisztiánné Szilágyi Brigitta,0,JournalArticle
2021,Reaction Kinetics Modeling of eHsp70 Induced by Norepinephrine in Response to Exercise Stress,"Lovas Attila,Koós Krisztiánné Szilágyi Brigitta",1,JournalArticle
2021,Nyelvi–matematikai kognitív mérőteszt alkalmazása a felsőoktatásba belépő hallgatóknál,Koós Krisztiánné Szilágyi Brigitta,0,JournalArticle
2021,How to utilize test results effectively?,Koós Krisztiánné Szilágyi Brigitta,0,BookChapter
2021,A hosszútávú tudás megszerzésének és a gondolkodás fejlesztésének hatékony eszközei a mérnökoktatásban,Koós Krisztiánné Szilágyi Brigitta,0,BookChapter
2021,Measuring geometric thinking of engineering students with van Hiele test,Koós Krisztiánné Szilágyi Brigitta,0,BookChapter
2022,An L-shaped method with strengthened lift-and-project cuts,Fábián Csaba,0,JournalArticle
2022,"A probabilistic formulation of a demand-side management problem, and its solution with a randomized scheme",Fábián Csaba,0,PublicationOther
2021,Vágósíkos eljárások sztochasztikus programozási alkalmazásáról,Fábián Csaba,0,BookChapter
2020,Gaining traction: on the convergence of an inner approximation scheme for probability maximization,Fábián Csaba,2,JournalArticle
2019,"A randomized method for handling a difficult function in a convex optimization problem, motivated by probabilistic programming","Fábián Csaba,Szántai Tamás",2,JournalArticle
2018,Probability maximization by inner approximation,"Fábián Csaba,Szántai Tamás",5,JournalArticle
2018,Valószínűség maximalizálás,Fábián Csaba,0,JournalArticle
2018,Experiments with randomized method for probability maximization,Fábián Csaba,0,BookChapter
2018,A randomized method for probabilistic problems,"Fábián Csaba,Szántai Tamás",0,PublicationOther
2017,On first-order methods in stochastic programmin,Fábián Csaba,0,PublicationOther
2011,A személyi jövedelemadó-reform hatása a tb-nyugdíjakra,Simonovits András,0,Book
2011,Designing benefit rules for flexible retirement,"Simonovits András,Tóth János",4,JournalArticle
2011,Local interaction in tax evasion,"Simonovits András,Tóth János",2,Book
2011,International economic crisis and the Hungarian pension reform,Simonovits András,2,Book
2011,A lengyel nyugdíjreformokról,Simonovits András,0,JournalArticle
2011,Higher tax morale implies a higher optimal income tax rate,Simonovits András,0,Book
2011,Impact of the economic and financial crisis on pension systems in Central and Eastern Europe,Simonovits András,3,JournalArticle
2011,The mandatory private pension pillar in Hungary,Simonovits András,39,JournalArticle
2011,Hogyan fedezték fel a logaritmust?,Simonovits András,0,JournalArticle
2011,"Alapnyugdíj, arányos nyugdíj, nyugdíjreform",Simonovits András,0,JournalArticle
2006,Optimal ball packings for crystallographic groups of the cubic crystal system and their Dirichlet-Voronoi cells,"Prok István,Szirmai Jenő",0,JournalArticle
2005,Kristályok és periodikus kövezések síkon és térben,"Molnár Emil,Prok István,Szirmai Jenő",0,JournalArticle
2003,"D-V cells and fundamental domains for crystallographic groups, algorithms and graphic realizations","Molnár Emil,Prok István,Szirmai Jenő",3,JournalArticle
2003,Polyhedron modelling and symmetry groups,Prok István,0,BookChapter
2003,Simply transitive optimal ball packings for the orientable crystallographic groups of the cubic system,"Prok István,Szirmai Jenő",0,JournalArticle
2002,"Bestimmung der transitiven optimalen Kugelpackungen für die 29 Raumgruppen, die Coxetersche Spiegelungsuntergruppen enthalten","Molnár Emil,Prok István,Szirmai Jenő",2,JournalArticle
2001,Packing congruent bricks into a cube,"G. Horváth Ákos,Prok István",0,JournalArticle
2001,Alaptartományszerű kövezések állandó görbületű terekben szabályos poliéderekkel,Prok István,0,Thesis
1999,Classification of hyperbolic manifolds and related orbifolds with charts up to two ideal simplices,"Molnár Emil,Prok István,Szirmai Jenő",2,BookChapter
1999,The Gieseking manifold and its surgery orbifolds,"Molnár Emil,Prok István,Szirmai Jenő",3,JournalArticle
2020,Isentropes and Lyapunov exponents,Keszthelyi Gabriella,0,JournalArticle
2019,"Isentropes, Lyapunov exponents and Ergodic averages",Keszthelyi Gabriella,0,Thesis
2017,Equi-topological entropy curves for skew tent maps in the square,Keszthelyi Gabriella,0,JournalArticle
2016,Convergence of ergodic averages for many group rotations,Keszthelyi Gabriella,0,JournalArticle
2015,My personal recollections on Kolya Chernov,Bálint Péter,0,JournalArticle
2012,Example for Exponential Growth of Complexity in a Finite Horizon Multi-dimensional Dispersing Billiard,"Bálint Péter,Sándor Csaba",8,JournalArticle
2012,Example for Exponential Growth of Complexity in a Finite Horizon Multi-dimensional Dispersing Billiard,"Bálint Péter,Tóth Imre Péter",8,JournalArticle
2012,Statistical properties of the system of two falling balls,"Bálint Péter,Borbély Gábor",2,JournalArticle
2011,Limit Theorems for Dispersing Billiards with Cusps,Bálint Péter,25,JournalArticle
2011,System of Two Falling Balls,"Bálint Péter,Borbély Gábor",0,PublicationOther
2011,Chaos and stability in a two-parameter family of convex billiard tables,Bálint Péter,6,JournalArticle
2010,Ergodicity and Energy Distributions for some Boundary Driven Integrable Hamiltonian Chains,Bálint Péter,5,JournalArticle
2008,Local ergodicity for systems with growth properties including multi-dimensional dispersing billiards,"Bálint Péter,Sándor Csaba",3,JournalArticle
2008,Local ergodicity for systems with growth properties including multi-dimensional dispersing billiards,"Bálint Péter,Tóth Imre Péter",3,JournalArticle
2008,"Decay of Correlations and Invariance Principles for Dispersing Billiards with Cusps, and Related Planar Billiard Flows",Bálint Péter,16,JournalArticle
2008,Exponential decay of correlations in multi-dimensional dispersing billiards,"Bálint Péter,Sándor Csaba",21,JournalArticle
2008,Exponential decay of correlations in multi-dimensional dispersing billiards,"Bálint Péter,Tóth Imre Péter",21,JournalArticle
2021,Kornai János (1928–2021),Simonovits András,0,JournalArticle
2021,Introducing Flexible Retirement,Simonovits András,0,JournalArticle
2021,A koronavírus-járvány és a magyar nyugdíjrendszer,Simonovits András,0,BookChapter
2021,"Itt a szomorú igazság a magyar nyugdíjasokról: minél gazdagabb valaki, annál tovább él",Simonovits András,0,PublicationOther
2021,Életpálya-jövedelemtől függő várható élettartam és a nyugdíjrendszer,Simonovits András,0,JournalArticle
2021,Longevity gap and public pensions,Simonovits András,0,PublicationOther
2021,"Mennyire fájna a költségvetésnek, ha szabadabban dönthetnénk a nyugdíjba vonulásról? Íme a számok",Simonovits András,0,PublicationOther
2021,A rugalmas nyugdíjkorhatár bevezetésének dinamikus elemzése,Simonovits András,0,JournalArticle
2021,Introducing flexible retirement,Simonovits András,0,PublicationOther
2021,A várható élettartam–jövedelem kapcsolat egyszerű ökonometriai becslése – újraelosztás a nyugdíjrendszerben,Simonovits András,0,JournalArticle
2022,Moments of the superdiffusive elephant random walk with general step distribution,Vető Bálint,0,JournalArticle
2022,Moments of the superdiffusive elephant random walk with general step distribution,Vető Bálint,0,JournalArticle
2022,"Asymptotic fluctuations of geometric q-TASEP, geometric q-PushTASEP and q-PushASEP",Vető Bálint,0,JournalArticle
2022,"Asymptotic fluctuations of geometric q-TASEP, geometric q-PushTASEP and q-PushASEP",Vető Bálint,0,JournalArticle
2021,"Height Fluctuations for the Stationary KPZ Equation (vol 18, 20, 2015)",Vető Bálint,0,JournalArticle
2021,"Height Fluctuations for the Stationary KPZ Equation (vol 18, 20, 2015)",Vető Bálint,0,JournalArticle
2021,Upper tail decay of KPZ models with Brownian initial conditions,Vető Bálint,3,JournalArticle
2021,Upper tail decay of KPZ models with Brownian initial conditions,Vető Bálint,3,JournalArticle
2021,Fluctuations of the arctic curve in the tilings of the Aztec diamond on restricted domains,Vető Bálint,1,JournalArticle
2021,Fluctuations of the arctic curve in the tilings of the Aztec diamond on restricted domains,Vető Bálint,1,JournalArticle
2020,Borodin–Péché Fluctuations of the Free Energy in Directed Random Polymer Models,Vető Bálint,3,JournalArticle
2020,Borodin–Péché Fluctuations of the Free Energy in Directed Random Polymer Models,Vető Bálint,3,JournalArticle
2017,The hard-edge tacnode process for Brownian motion,Vető Bálint,4,JournalArticle
2017,The hard-edge tacnode process for Brownian motion,Vető Bálint,4,JournalArticle
2016,Ages of Records in Random Walks,Vető Bálint,4,JournalArticle
2016,Ages of Records in Random Walks,Vető Bálint,4,JournalArticle
2015,Height Fluctuations for the Stationary KPZ Equation,Vető Bálint,80,JournalArticle
2015,Height Fluctuations for the Stationary KPZ Equation,Vető Bálint,80,JournalArticle
2015,Tracy-Widom asymptotics for q-TASEP,Vető Bálint,39,JournalArticle
2015,Tracy-Widom asymptotics for q-TASEP,Vető Bálint,39,JournalArticle
2022,Exact L2 Bernstein–Markov inequality on the ball,Kroó András,0,JournalArticle
2022,On Discretizing Uniform Norms of Exponential Sums,Kroó András,0,JournalArticle
2022,On discretizing integral norms of exponential sums,Kroó András,0,JournalArticle
2021,Bernstein-markov type inequalities and discretization of norms,Kroó András,0,JournalArticle
2021,Sharp L-p Bernstein type inequality for cuspidal domains in R-d,Kroó András,0,JournalArticle
2020,On a refinement of Marcinkiewicz-Zygmund type inequalities,Kroó András,0,JournalArticle
2020,Sharp Lp Markov type inequality for cuspidal domainsin Rd,Kroó András,2,JournalArticle
2019,On the existence of optimal meshes in every convex domain on the plane,Kroó András,4,JournalArticle
2019,Weierstrass type approximation by weighted polynomials in Rd,Kroó András,0,JournalArticle
2019,Density of multivariate homogeneous polynomials on star like domains,Kroó András,1,JournalArticle
2019,"Én, Alkméné",Molnár Zoltán Gábor,0,JournalArticle
2018,Milyen matematikát kell tanítanunk és azt hogyan?,Molnár Zoltán Gábor,0,JournalArticle
2017,BME Alfa: interaktív gyakorlás és versenyzés,"Molnár Zoltán Gábor,Nagy Ilona,Lángné Lázi Márta",0,JournalArticle
2017,Indefinite descriptions in typed lambda calculus,Molnár Zoltán Gábor,0,BookChapter
2017,Torkel Franzén: Gödel nemteljességi tételei - értelmezések és félreértések,Molnár Zoltán Gábor,0,JournalArticle
2016,Ron Aharoni: Ördögi körök,Molnár Zoltán Gábor,0,JournalArticle
2015,A Desargues-tétel tanításáról,Molnár Zoltán Gábor,0,BookChapter
2014,A lélektől a deskripciókig,Molnár Zoltán Gábor,0,BookChapter
2013,Epsilon-Invariant Substitutions and Indefinite Descriptions,Molnár Zoltán Gábor,0,JournalArticle
