publishedYear,name,authors,independentCitingPubCount,types
2008,Combinatorial Diophantine equations - the genus 1 case,Lality-Kovács Tünde,2,JournalArticle
2016,Qualitative properties of the finite difference solution of a space-time epidemic propagation model,"Faragó István György,Horváth Róbert",0,JournalArticle
2016,Qualitatively adequate numerical modelling of spatial SIRS-type disease propagation,"Faragó István György,Horváth Róbert",2,JournalArticle
2016,On some qualitatively adequate discrete space-time models of epidemic propagation,"Faragó István György,Horváth Róbert",6,JournalArticle
2016,On a Spatial Epidemic Propagation Model,"Faragó István György,Horváth Róbert",0,BookChapter
2016,Some Notes on the Sequence Acceleration,Faragó István György,0,JournalArticle
2016,MATHEMATICAL MODELS OF SPATIAL DISEASE PROPAGATION AND THEIR QUALITATIVE PROPERTIES,Faragó István György,0,BookChapter
2016,EFFICIENT NUMERICAL METHODS IN AIR POLLUTION TRANSPORT MODELLING: OPERATOR SPLITTING AND RICHARDSON EXTRAPOLATION,Faragó István György,0,BookChapter
2016,Stability of patterns and of constant steady states for a cross-diffusion system,"Svantnerné Sebestyén Gabriella,Faragó István György,Horváth Róbert",3,JournalArticle
2016,The effect of tree-diffusion in a mathematical model of Easter Island’s population,"Takács Bálint Máté,Horváth Róbert,Faragó István György",3,JournalArticle
2016,Impact of Climatic Changes on Pollution Levels,Faragó István György,2,BookChapter
2018,On a conjecture of Erdős about sets without k pairwise coprime integers,Kiss Sándor,0,JournalArticle
2018,Bloom Filter with a False Positive Free Zone,"Kiss Sándor,Rónyai Lajos",21,BookChapter
2018,On generalized Stanley sequences,Kiss Sándor,1,JournalArticle
2017,Partitions of the set of nonnegative integers with the same representation functions,Kiss Sándor,14,JournalArticle
2017,On the multiplicativity of the linear combination of additive representation functions,Kiss Sándor,1,JournalArticle
2016,On the maximum values of the additive representation functions,Kiss Sándor,1,JournalArticle
2015,Approximate Counting of Graphical Realizations,Kiss Sándor,23,JournalArticle
2015,On a Parity Based Group Testing Algorithm,"Kiss Sándor,Rónyai Lajos",0,JournalArticle
2014,On additive complement of a finite set,Kiss Sándor,7,JournalArticle
2014,"Groups, partitions and representation functions",Kiss Sándor,5,JournalArticle
1981,Decomposition of matrices in a genetic problem,Bolla Marianna,0,BookChapter
1981,Decomposition of matrices in a genetic problem,Bolla Marianna,0,JournalArticle
1981,"Statistical study on the multiple congenital abnormalities in Hungary, 1970-1976",Bolla Marianna,0,PublicationOther
1980,Stochastic Phosphorus Loading Model for Lake Balaton,Bolla Marianna,0,BookChapter
1980,Veleszületett rendellenességek közti kapcsolatok megállapítása mátrixok szinguláris felbontásával,Bolla Marianna,0,BookChapter
1980,Modelling the influence of the watershed on the eutrophication of Lake Blaton,Bolla Marianna,0,BookChapter
1979,A Balaton eutrofizálódásának modellezése,Bolla Marianna,0,PublicationOther
1979,A balatoni ökoszisztéma modellezése,Bolla Marianna,0,Book
1979,Többszörös veleszületett rendellenességek statisztikai vizsgálata,Bolla Marianna,0,BookChapter
1979,A Balaton-vízgyűjtő hierarchikus rendszermodellezése,Bolla Marianna,0,BookChapter
1998,Group invariants of certain Burn loop classes,Nagy Gábor Péter,5,JournalArticle
1998,Solvability of universal Bol 2-loops,Nagy Gábor Péter,2,JournalArticle
1997,Caps in finite projective spaces of odd order,Nagy Gábor Péter,5,JournalArticle
1994,Collineation groups of the smallest Bol 3-nets,Nagy Gábor Péter,1,JournalArticle
1992,A p-adikus számok egy alkalmazása,Nagy Gábor Péter,0,JournalArticle
2022,A higher order resolvent-positive finite difference approximation for fractional derivatives on bounded domains,Kovács Mihály,0,JournalArticle
2022,Some approximation results for mild solutions of stochastic fractional order evolution equations driven by Gaussian noise,Kovács Mihály,0,JournalArticle
2022,SURFACE FINITE ELEMENT APPROXIMATION OF SPHERICAL WHITTLE--MAT\\'ERN GAUSSIAN RANDOM FIELDS,Kovács Mihály,0,JournalArticle
2022,Approximation of SPDE covariance operators by finite elements: a semigroup approach,Kovács Mihály,0,JournalArticle
2022,Hilbert-Schmidt regularity of symmetric integral operators on bounded domains with applications to SPDE approximations,Kovács Mihály,0,JournalArticle
2021,Error estimates of the backward Euler–Maruyama method for multi-valued stochastic differential equations,Kovács Mihály,0,JournalArticle
2021,Stochastic reaction–diffusion equations on networks,Kovács Mihály,0,JournalArticle
2021,On the stochastic Allen–Cahn equation on networks with multiplicative noise,Kovács Mihály,0,JournalArticle
2021,"Corrigendum to ""On the stochastic Allen–Cahn equation on networks with multiplicative noise"" [Electron. J. Qual. Theory Differ. Equ. 2021, No. 7, 1–24]",Kovács Mihály,0,JournalArticle
2020,Numerical solution of fractional elliptic stochastic PDEs with spatial white noise,Kovács Mihály,13,JournalArticle
2022,Effectivity Analysis of Operator Splitting and the Average Method,"Boda Lívia,Faragó István György",0,BookChapter
2021,The Average Method is Much Better Than Average,"Boda Lívia,Faragó István György",0,JournalArticle
2020,INVESTIGATION OF DIFFERENT OPERATOR SPLITTING METHODS,Boda Lívia,0,JournalArticle
2014,On the volume of the convex hull of two convex bodies,"G. Horváth Ákos,Lángi Zsolt",2,JournalArticle
2014,"Addendum to the paper ""Hyperbolic plane geometry revisited""",G. Horváth Ákos,0,PublicationOther
2014,On an extremal problem connected with simplices.,G. Horváth Ákos,1,JournalArticle
2013,Normally distributed probability measure on the metric space of norms,G. Horváth Ákos,4,JournalArticle
2013,Bounded representation and radial projections of bisectors in normed spaces.,G. Horváth Ákos,2,JournalArticle
2013,Csodálatos geometria avagy a kapcsolatteremtés tudománya,G. Horváth Ákos,1,Book
2012,Formulas on hyperbolic volume.,G. Horváth Ákos,6,JournalArticle
2011,Kombinatorikus geometria,"G. Horváth Ákos,Lángi Zsolt",0,Book
2011,Premanifolds,G. Horváth Ákos,4,JournalArticle
2011,Conics in Normed Planes,G. Horváth Ákos,12,JournalArticle
1966,A note on Jensen's inequality,Csiszár Imre,2,JournalArticle
1963,Eine Informationtheorietische Ungleichtung und ihre Anwendung auf den Beweis der ergodizitat von Markoffschen Ketten,Csiszár Imre,248,JournalArticle
1962,On the dimension and entropy of order α of the mixture of probability distributions,Csiszár Imre,3,JournalArticle
1961,Some remarks on the dimension and entropy of random variables,Csiszár Imre,5,JournalArticle
2021,The disc embedding theorem,Kalmár Boldizsár,0,Book
2020,Fold cobordisms and a Poincare-Hopf type theorem for the signature,Kalmár Boldizsár,0,PublicationOther
2016,Interlacement of Double Curves of Immersed Spheres,Kalmár Boldizsár,0,JournalArticle
2013,Singular maps on exotic 4-manifold pairs,Kalmár Boldizsár,1,JournalArticle
2012,Maps on 3-manifolds given by surgery,Kalmár Boldizsár,1,JournalArticle
2012,Characteristic classes and existence of singular maps,Kalmár Boldizsár,2,JournalArticle
2009,"Cobordism of fold maps, stably framed manifolds, and a Poincaré-Hopf type theorem for the signature",Kalmár Boldizsár,0,BookChapter
2009,Fold maps and immersions from the viewpoint of cobordism,Kalmár Boldizsár,2,JournalArticle
2009,Fold cobordisms and stable homotopy groups,Kalmár Boldizsár,0,JournalArticle
2008,Cobordism invariants of fold maps,Kalmár Boldizsár,4,JournalArticle
2020,Jordan isomorphisms as preservers,Molnár Lajos Gábor,1,JournalArticle
2020,Maps on positive cones in operator algebras preserving power means,Molnár Lajos Gábor,1,JournalArticle
2020,SPECTRAL CHARACTERIZATION OF JORDAN-SEGAL ISOMORPHISMS OF QUANTUM OBSERVABLES,Molnár Lajos Gábor,1,JournalArticle
2019,Characterizations of certain means of positive operators,Molnár Lajos Gábor,1,JournalArticle
2019,On 2-local *-automorphisms and 2-local isometries of B(H),Molnár Lajos Gábor,6,JournalArticle
2019,Quantum Rényi relative entropies on density spaces of C⁎-algebras: Their symmetries and their essential difference,Molnár Lajos Gábor,0,JournalArticle
2018,Busch-Gudder metric on the Cone of Positive Semidefinite Operators and Its Isometries,Molnár Lajos Gábor,1,JournalArticle
2018,Bures isometries between density spaces of C*-algebras,Molnár Lajos Gábor,2,JournalArticle
2018,Maps between the positive definite cones of operator algebras preserving a norm of a geodesic correspondence,Molnár Lajos Gábor,0,JournalArticle
2017,Transformations on density operators and on positive definite operators preserving the quantum Rényi divergence,Molnár Lajos Gábor,1,JournalArticle
2005,On the uniqueness of diffeomorphism symmetry in conformal field theory.,Weiner Mihály,22,JournalArticle
2002,Poincare covariance of relativistic quantum position,Weiner Mihály,2,JournalArticle
2001,Simple solutions of fireball hydrodynamics for self-similar elliptic flows,Weiner Mihály,9,JournalArticle
2022,Routing on the Shortest Pairs of Disjoint Paths,Rónyai Lajos,0,BookChapter
2022,Some Complexity Results Involving Quantum Computing,Rónyai Lajos,0,JournalArticle
2021,An upper bound for the size of s-distance sets in real algebraic sets,Rónyai Lajos,0,JournalArticle
2021,Bloom Filter with a False Positive Free Zone,"Kiss Sándor,Rónyai Lajos",1,JournalArticle
2021,On Network Topology Augmentation for Global Connectivity under Regional Failures,Rónyai Lajos,1,BookChapter
2021,Probabilistic Shared Risk Link Groups Modeling Correlated Resource Failures Caused by Disasters,Rónyai Lajos,3,JournalArticle
2020,Minimum Cost Survivable Routing Algorithms for Generalized Diversity Coding,Rónyai Lajos,7,JournalArticle
2020,Fast Enumeration of Regional Link Failures Caused by Disasters With Limited Size,Rónyai Lajos,2,JournalArticle
2019,Exploring projective norm graphs,Rónyai Lajos,0,JournalArticle
2019,Explicit equivalence of quadratic forms over Fq ( t ),Rónyai Lajos,4,JournalArticle
2007,Methods of Systems Using Geographic Meta-Metadata in Information Retrieval and Document Displays,Kornai András,73,Patent
2006,Web-based frequency dictionaries for medium density languages,Kornai András,37,BookChapter
2006,Using a morphological analyzer in high precision POS tagging of Hungarian,Kornai András,22,BookChapter
2006,Guarded optimalism,Kornai András,4,PublicationOther
2006,Is OT NP-hard,Kornai András,6,PublicationOther
2006,Evaluating geographic information retrieval,Kornai András,16,BookChapter
2006,Naturalizmus a matematikában,Kornai András,0,JournalArticle
2006,The Annotation system of hunmorph,Kornai András,1,BookChapter
2005,A Hunglish korpusz és szótár,Kornai András,25,BookChapter
2005,Morfológiai egyértelműsítés maximum entrópia módszerrel,Kornai András,2,BookChapter
1986,On multidimensional universal functions,Horváth Miklós Tibor,6,JournalArticle
1986,On convex functions,Horváth Miklós Tibor,5,JournalArticle
1986,A remark on signum type orthonormal systems,Horváth Miklós Tibor,0,JournalArticle
1970,Véletlen pontfolyamatok ritkítása,Szántai Tamás,0,Thesis
1969,Véletlen pontfolyamatok ritkítása,Szántai Tamás,0,PublicationOther
2012,Hypergraphs as a mean of discovering the dependence structure of a discrete multivariate probability distribution,"Szántai Tamás,Kovács Edith Alice",11,JournalArticle
2012,Portfolio selection using the dependence structure of the assets,"Szántai Tamás,Kovács Edith Alice",0,BookChapter
2011,Computing Bounds for the Probability of Union of Events by Different Methods,Szántai Tamás,0,PublicationOther
2011,Pattern recognition using t-cherry junction tree structures,"Szántai Tamás,Kovács Edith Alice",0,JournalArticle
2010,On the approximation of a discrete multivariate probability distribution using the new concept of t-cherry junction tree,"Kovács Edith Alice,Szántai Tamás",4,BookChapter
2010,On numerical calculation of probabilities according to Dirichlet distribution,Szántai Tamás,13,JournalArticle
2010,On the analytical-numerical valuation of the Bermudan and American options,Szántai Tamás,2,JournalArticle
2010,Természetes vízfolyások öntözővíz készletének meghatározását célzó matematikai modellek,Szántai Tamás,1,JournalArticle
2010,Application of t-Cherry junction trees in Pattern Recognition,"Szántai Tamás,Kovács Edith Alice",0,JournalArticle
2010,Bounds and approximations on the realiability of large networks,"Szántai Tamás,Kovács Edith Alice",0,BookChapter
2006,Positive decomposition of transfer functions with multiple poles,"Nagy Béla,Matolcsi Máté,Nagyné Szilvási Márta",0,JournalArticle
2005,Minimal positive realizations of transfer functions with nonnegative multiple poles,"Nagy Béla,Matolcsi Máté",33,JournalArticle
2004,Nonnegative unitary operators,Nagy Béla,2,JournalArticle
2004,Estimates for the dimensions of nonnegative realizations,"Matolcsi Máté,Nagy Béla",1,JournalArticle
2003,On nonnegative realizations,Nagy Béla,0,BookChapter
2003,Connections between realizations of a transfer function,Nagy Béla,0,JournalArticle
2003,On spectra of expansion graphs and matrix polynomials,Nagy Béla,1,JournalArticle
2003,Algorithm for positive realization of transfer functions,"Nagy Béla,Matolcsi Máté",8,JournalArticle
2002,On spectra of expansion graphs and matrix polynomials II,Nagy Béla,2,JournalArticle
2001,Linear independence of Jordan chains,Nagy Béla,0,BookChapter
1997,Some extremal problems for multivariate polynomials on convex bodies,Kroó András,12,JournalArticle
1996,Approximation by constrained and unconstrained polynomials on finite and infinite intervals,Kroó András,0,BookChapter
1996,On weighted approximation by lacunary polynomials and rational functions on the half-axis,Kroó András,3,JournalArticle
1995,Approximation by constrained and unconstrained polynomials on finite and infinite intervals,Kroó András,0,JournalArticle
1995,WEIGHTED POLYNOMIAL-APPROXIMATION ON THE REAL LINE,Kroó András,11,JournalArticle
1995,Approximation by lacunary Bernstein and self-reciprocal polynomials,Kroó András,0,JournalArticle
1995,On weighted polynomial approximation on the plane,Kroó András,0,JournalArticle
1994,MUNTZ-TYPE PROBLEMS FOR BERNSTEIN POLYNOMIALS,Kroó András,2,JournalArticle
1994,Constructive properties of self-reciprocal polynomials,Kroó András,4,JournalArticle
1994,On approximation by bivariate incomplete polynomials,Kroó András,1,JournalArticle
2020,Az online matematikaoktatás tapasztalatai oktatói és hallgatói szemmel,"Fülöp Otília,Nagy Marcell",0,JournalArticle
2019,Predicting Dropout Using High School and First-semester Academic Achievement Measures,"Nagy Marcell,Molontay Roland",6,BookChapter
2019,On the structural properties of social networks and their measurement-calibrated synthetic counterparts,"Nagy Marcell,Molontay Roland",1,BookChapter
2019,A Web Application for Predicting Academic Performance and Identifying the Contributing Factors,"Nagy Marcell,Molontay Roland",1,BookChapter
2019,Two decades of network science: : as seen through the co-authorship network of network scientists,"Molontay Roland,Nagy Marcell",18,BookChapter
2019,Machine learning algorithms for predicting academic performance and identifying the contributing factors,"Molontay Roland,Nagy Marcell",0,BookChapter
2018,Predictive power of admission point score and its variants on academic performance,"Nagy Marcell,Molontay Roland",0,BookChapter
2018,Predicting Dropout in Higher Education based on Secondary School Performance,"Nagy Marcell,Molontay Roland",37,BookChapter
2018,Data-driven Analysis of Complex Networks and their Model-generated Counterparts,"Nagy Marcell,Molontay Roland",0,PublicationOther
2017,Merging B-spline curves or surfaces using matrix representation,"Balla-Seethalerné Béla Szilvia,Nagyné Szilvási Márta",0,JournalArticle
2017,Adjusting curvatures of B-spline surfaces by operations on knot vectors,"Balla-Seethalerné Béla Szilvia,Nagyné Szilvási Márta",0,JournalArticle
2016,Manipulating end conditions of B-spline curves using knot sliding,"Balla-Seethalerné Béla Szilvia,Nagyné Szilvási Márta",0,BookChapter
2016,Changing tangent and curvature data of B-splines via knot manipulation,"Balla-Seethalerné Béla Szilvia,Nagyné Szilvási Márta",0,BookChapter
2014,General Matrix Representation of B-Splines and Approximation of B-Spline Curves and Surfaces with Third Order Continuity,"Balla-Seethalerné Béla Szilvia,Nagyné Szilvási Márta",0,BookChapter
2013,Mathematical analysis of capillary elevation in porous limestone,Balla-Seethalerné Béla Szilvia,0,JournalArticle
2013,Stitching B-Spline Curves Symbolically,"Nagyné Szilvási Márta,Balla-Seethalerné Béla Szilvia",0,JournalArticle
2013,Geometric Simulation of Locally Optimal Tool Paths in Three-Axis Milling,"Nagyné Szilvási Márta,Balla-Seethalerné Béla Szilvia",0,JournalArticle
2012,Real Root Approximation Using Fat Spheres,Balla-Seethalerné Béla Szilvia,0,JournalArticle
2012,Approximating Algebraic Space Curves by Circular Arcs,Balla-Seethalerné Béla Szilvia,1,BookChapter
1999,Kutatás és közlés a természettudományokban,Tóth János,46,Book
1999,Path integrals and non-equilibrium thermodynamics,Tóth János,0,BookChapter
1999,Variational nonequilibrium thermodynamics of reaction-diffusion systems. II.,Tóth János,0,JournalArticle
1999,Variational nonequilibrium thermodynamics of reaction-diffusion systems. I.,Tóth János,0,JournalArticle
1999,Numerical and symbolic applications of Mathematica,Tóth János,0,JournalArticle
1999,Multistationarity is neither sufficient nor necessary to oscillation,Tóth János,5,JournalArticle
1998,Dissipation of energy and information in nonequilibrium reaction-diffusion systems,Tóth János,6,JournalArticle
1998,Stability of polynomials,Tóth János,4,JournalArticle
1997,Master equation and Fokker--Planck equation: Comparison of entropy and rate constants,Tóth János,2,JournalArticle
1997,On the origin of Turing instability,Tóth János,10,JournalArticle
2022,The structure of algebraic Baer∗-algebras,Takács Balázs,0,JournalArticle
2021,"Hermitian and algebraic *-algebras,representable extensions of positive functionals","Szűcs Zsolt,Takács Balázs",1,JournalArticle
2021,Hermitikus *-algebrák és pozitív funkcionálok kiterjesztései,Takács Balázs,0,Thesis
2019,Representable extensions of positive functionals and hermitian Banach *-algebras,"Szűcs Zsolt,Takács Balázs",1,JournalArticle
2000,On local automorphism of group algebras of compact groups,Molnár Lajos Gábor,17,JournalArticle
1999,Multiplicative maps on ideals of operators which are local automorphisms,Molnár Lajos Gábor,6,JournalArticle
1999,Some multiplicative preservers on B(H),Molnár Lajos Gábor,14,JournalArticle
1999,A generalization of Wigner's unitary-antiunitary theorem to Hilbert modules,Molnár Lajos Gábor,23,JournalArticle
1999,Reflexivity of the group of surjective isometries on some Banach spaces,Molnár Lajos Gábor,37,JournalArticle
1999,Some linear preserver problems on B(H) concerning rank and corank,Molnár Lajos Gábor,10,JournalArticle
1998,Diameter preserving linear bijections of C(X),Molnár Lajos Gábor,27,JournalArticle
1998,Linear rank and corank preserving maps on B(H) and an application to *-semigroup isomorphisms of operator ideals,Molnár Lajos Gábor,7,JournalArticle
1998,Linear maps on factors which preserve the extreme points of the unit ball,Molnár Lajos Gábor,5,JournalArticle
1998,An algebraic approach to Wigner's unitary-antiunitary theorem,Molnár Lajos Gábor,28,JournalArticle
1994,"Decomposition of algebras over Fq(X1,...,Xm)",Rónyai Lajos,10,JournalArticle
1994,Fermat utolsó tétele (Fermat's Last Theorem ),Rónyai Lajos,1,JournalArticle
1994,A deterministic method for computing splitting elements in simple algebras over Q,Rónyai Lajos,10,JournalArticle
1993,Equality schemes and equality scheme dependencies in relational databases,Rónyai Lajos,0,JournalArticle
1993,Functional dependencies among Boolean dependencies,Rónyai Lajos,0,BookChapter
1993,Finding maximal orders in semisimple algebras over Q,Rónyai Lajos,22,JournalArticle
1993,Computations in associative algebras,Rónyai Lajos,10,BookChapter
1992,On the Composition and Decomposition of Attributes and Tuples,Rónyai Lajos,1,JournalArticle
1992,A note on intersections of isotone clones,Rónyai Lajos,4,JournalArticle
1992,Elliptikus görbék és Fermat-sejtés (Elliptic curves and Fermat's Last Theorem),Rónyai Lajos,1,JournalArticle
2010,A Short Proof for the Completeness of Paramodulation,Sági Gábor,0,JournalArticle
2010,Absolutely ubiquitous structures and aleph_0-stability,Sági Gábor,0,JournalArticle
2009,Representation of ideals of relational structures,Sági Gábor,5,JournalArticle
2009,Completeness of paramodulation and equational logic,Sági Gábor,0,BookChapter
2008,Horizons of Combinatorics,Sági Gábor,0,Book
2007,Matematikai logika: a filozófiától az informatikáig,Sági Gábor,0,JournalArticle
2006,On some developments in the representation theory of cylindrical-like algebras,"Ferenczi Miklós,Sági Gábor",7,JournalArticle
2006,On weak and strong interpolation in algebraic logics,Sági Gábor,20,JournalArticle
2005,On topological properties of ultraproducts of finite sets,Sági Gábor,1,JournalArticle
2004,Válogatott fejezetek a modellelméletből,Sági Gábor,0,Book
2008,Special issue on advanced numerical algorithms for large-scale computations: Introduction,Faragó István György,0,JournalArticle
2008,On the Richardson extrapolation as applied to the sequential splitting method,Faragó István György,0,BookChapter
2008,Qualitative properties of monotone linear parabolic operators,Faragó István György,2,BookChapter
2008,Computers & Mathematics with Applications,Faragó István György,0,PublicationOther
2008,Applied Mathematical Modelling,Faragó István György,0,PublicationOther
2008,Parallelization of advection-diffusion-chemistry modules,Faragó István György,0,BookChapter
2008,Numerical and computational issues related to applied mathematical modelling - Preface,Faragó István György,0,JournalArticle
2008,On the additive splitting procedures and their computer realization,Faragó István György,4,JournalArticle
2008,Sobolev gradient type preconditioning for the Saint-Venant model of elasto-plastic torsion,"Faragó István György,Karátson János",1,JournalArticle
2008,Stabilization of a Numerical Model Through the Boundary Conditions for the Real-Time Simulation of Fuel Cells,Faragó István György,0,BookChapter
1981,Constrained control and destabilisation,Simonovits András,3,BookChapter
1981,Control by order-signals,Simonovits András,3,BookChapter
1981,Stock-signal model regulated from a normal path,Simonovits András,7,BookChapter
1981,Korlátos szabályozás és destabilizálás,Simonovits András,3,BookChapter
1981,Rendelésjelzéses szabályozás,Simonovits András,2,BookChapter
1981,Normál pályáról vezérelt készletjelzéses modell,Simonovits András,3,BookChapter
1980,"Matematikai függelék - A kényszerhelyettesítés, a készlet és a súrlódás összefüggései",Simonovits András,0,BookChapter
1980,Mathematical appendix B,Simonovits András,0,BookChapter
1980,A költségmegosztás elméletéről,Simonovits András,0,JournalArticle
1979,Mégegyszer a várakozásokról,Simonovits András,1,JournalArticle
2012,Multigraph limit of the dense configuration model and the preferential attachment graph,Ráth Balázs,9,JournalArticle
2012,Time evolution of dense multigraph limits under edge‐conservative preferential attachment dynamics,Ráth Balázs,5,JournalArticle
2012,Connectivity properties of random interlacement and intersection of random walks,Ráth Balázs,20,JournalArticle
2011,Multigraph limits and exchangeability,Ráth Balázs,5,JournalArticle
2011,On the transience of random interlacements,Ráth Balázs,15,JournalArticle
2010,Asymptotic behavior of random graphs evolving in time,Ráth Balázs,0,Thesis
2009,Erdős-Rényi random graphs + forest fires = self-organized criticality,Ráth Balázs,39,JournalArticle
2009,Mean field frozen percolation,Ráth Balázs,13,JournalArticle
2008,Triangle percolation in mean field random graphs -- with PDE,Ráth Balázs,5,JournalArticle
2006,The lex game and some applications,"Ráth Balázs,Rónyai Lajos",25,JournalArticle
1992,Számítástechnika,Tóth János,0,Book
1992,Anyagmegmaradás összetett kémiai mechanizmusokban,Tóth János,2,JournalArticle
1992,"Elmélet, modell, hagyomány",Tóth János,1,Book
1992,Az egzotikus kinetikai rendszerek matematikájának alapjai,Tóth János,0,BookChapter
1992,A sztochasztikus kinetikai modellek nélkülözhetetlensége,Tóth János,0,BookChapter
1992,A functional equation related to random fields,Tóth János,1,JournalArticle
1992,CLASSICS REVISITED - COMMENTS TO AN ARTICLE OF FRANKKAMENETSKII ON THE QUASI-STEADY-STATE APPROXIMATION,Tóth János,14,JournalArticle
1990,"Structures, hypergraphs and knowledge representation in chemical engineering science. I",Tóth János,1,JournalArticle
1990,WHAT IS AND WHAT IS NOT STATED BY THE MAY-WIGNER THEOREM,Tóth János,10,JournalArticle
1989,Mathematical Models of Chemical Reactions,Tóth János,192,Book
2005,The optimal ball and horoball packings of the Coxeter tilings in the hyperbolic 3-space,Szirmai Jenő,10,JournalArticle
2005,"Horoball packings for the Lambert-cube tilings in the hyperbolic 3-space,",Szirmai Jenő,2,JournalArticle
